{"event_type":"network_reconnaissance","source_ip":"192.168.10.10","window_start":"2026-07-27T07:16:00+07:00","window_end":"2026-07-27T07:16:30+07:00","unique_destination_ports":6,"unique_destination_hosts":1,"failed_connections":12,"admin_service_attempts":6,"unique_http_uris":0,"time_window_seconds":30,"risk_score":35,"risk_level":"Medium","classification":"probable_admin_service_probing","signals":["high_failed_connection_count","administrative_service_probing"],"evidence_source":"zeek_conn_log"}
