{"event_type":"network_reconnaissance","source_ip":"192.168.10.10","window_start":"2026-07-27T06:12:00+07:00","window_end":"2026-07-27T06:12:30+07:00","unique_destination_ports":1,"unique_destination_hosts":6,"failed_connections":0,"admin_service_attempts":0,"unique_http_uris":0,"time_window_seconds":30,"risk_score":25,"risk_level":"Low","classification":"probable_host_discovery","signals":["multi_host_discovery"],"evidence_source":"zeek_conn_log"}
