{"event_type":"network_reconnaissance","source_ip":"192.168.10.10","window_start":"2026-07-28T10:53:30+07:00","window_end":"2026-07-28T10:54:00+07:00","unique_destination_ports":100,"unique_destination_hosts":1,"failed_connections":200,"admin_service_attempts":2,"unique_http_uris":0,"time_window_seconds":30,"risk_score":80,"risk_level":"Critical","classification":"probable_port_scan","signals":["high_unique_port_count","high_failed_connection_count"],"evidence_source":"zeek_conn_log"}
